### ISSUE TITLE
Rexray EFS hangs for 1 minute polling port 111 before using nfs4

### ISSUE THREAD

**Issue by bmitch3020** [codedellemc/rexray#916]
# Summary
While creating a new container with an EFS volume, the run command hangs for 60 seconds while RexRay polls port 111 without any response from AWS. After that minute, it switches to NFS4 on port 2049 and immediately connects, allowing the container run to complete.

# Bug Reports

## Version
Running this as a docker plugin, installed today. 

```shell
# docker plugin inspect rexray/efs
[
    {
        "Config": {
            "Args": {
                "Description": "",
                "Name": "",
                "Settable": null,
                "Value": null
            },
            "Description": "REX-Ray for Amazon EFS",
            "DockerVersion": "17.06.0-ce",
            "Documentation": "https://github.com/codedellemc/rexray/.docker/plugin/efs",
            "Entrypoint": [
                "/rexray.sh",
                "rexray",
                "start",
                "-f",
                "--nopid"
            ],
...
```

(output cropped to avoid including AWS secrets)

I found the following log buried in /var/lib/docker/plugins/...

```
REX-Ray
-------
Binary: /usr/bin/rexray
Flavor: client+agent+controller
SemVer: 0.9.2
OsArch: Linux-x86_64
Branch: v0.9.2
Commit: 9c7b7329884bf2feeffe101fc5dc3a239730427d
Formed: Wed, 28 Jun 2017 20:18:43 UTC

libStorage
----------
SemVer: 0.6.2
OsArch: Linux-x86_64
Branch: v0.9.2
Commit: 7368564cc71be9a0dbe03ddfbaeda281232eee72
Formed: Wed, 28 Jun 2017 20:18:22 UTC
```

## Expected Behavior
The volume creation and mount should happen immediately using nfs4.

## Actual Behavior

The `docker run` command shows the delay:

```
# time docker run -it --rm --volume-driver rexray/efs -v swarm-efs-test:/data busybox ls /data                                                                                                                    

real    1m1.182s
user    0m0.011s
sys     0m0.005s
```

The `tcpdump` shows the 60 second delay while it tries to connect to port 111:

```
# tcpdump -nv -i any host 10.10.1.124
tcpdump: listening on any, link-type LINUX_SLL (Linux cooked), capture size 262144 bytes
19:20:28.722158 IP (tos 0x0, ttl 64, id 44941, offset 0, flags [DF], proto TCP (6), length 60)
    10.10.1.169.55246 > 10.10.1.124.111: Flags [S], cksum 0x1767 (incorrect -> 0x7e0b), seq 76077824, win 26883, options [mss 8961,sackOK,TS val 1602701 ecr 0,nop,wscale 7], length 0
19:20:29.724353 IP (tos 0x0, ttl 64, id 44942, offset 0, flags [DF], proto TCP (6), length 60)
    10.10.1.169.55246 > 10.10.1.124.111: Flags [S], cksum 0x1767 (incorrect -> 0x7a20), seq 76077824, win 26883, options [mss 8961,sackOK,TS val 1603704 ecr 0,nop,wscale 7], length 0
19:20:31.728357 IP (tos 0x0, ttl 64, id 44943, offset 0, flags [DF], proto TCP (6), length 60)
    10.10.1.169.55246 > 10.10.1.124.111: Flags [S], cksum 0x1767 (incorrect -> 0x724c), seq 76077824, win 26883, options [mss 8961,sackOK,TS val 1605708 ecr 0,nop,wscale 7], length 0
19:20:33.732331 ARP, Ethernet (len 6), IPv4 (len 4), Request who-has 10.10.1.124 tell 10.10.1.169, length 28
19:20:33.732460 ARP, Ethernet (len 6), IPv4 (len 4), Reply 10.10.1.124 is-at 0e:3e:be:10:53:74, length 42
19:20:35.732357 IP (tos 0x0, ttl 64, id 44944, offset 0, flags [DF], proto TCP (6), length 60)
    10.10.1.169.55246 > 10.10.1.124.111: Flags [S], cksum 0x1767 (incorrect -> 0x62a8), seq 76077824, win 26883, options [mss 8961,sackOK,TS val 1609712 ecr 0,nop,wscale 7], length 0
19:20:43.748357 IP (tos 0x0, ttl 64, id 44945, offset 0, flags [DF], proto TCP (6), length 60)
    10.10.1.169.55246 > 10.10.1.124.111: Flags [S], cksum 0x1767 (incorrect -> 0x4358), seq 76077824, win 26883, options [mss 8961,sackOK,TS val 1617728 ecr 0,nop,wscale 7], length 0
19:20:59.780363 IP (tos 0x0, ttl 64, id 44946, offset 0, flags [DF], proto TCP (6), length 60)
    10.10.1.169.55246 > 10.10.1.124.111: Flags [S], cksum 0x1767 (incorrect -> 0x04b8), seq 76077824, win 26883, options [mss 8961,sackOK,TS val 1633760 ecr 0,nop,wscale 7], length 0
19:21:28.743644 IP (tos 0x0, ttl 64, id 54977, offset 0, flags [DF], proto TCP (6), length 60)
    10.10.1.169.715 > 10.10.1.124.2049: Flags [S], cksum 0x1767 (incorrect -> 0xd589), seq 3779234242, win 26883, options [mss 8961,sackOK,TS val 1662723 ecr 0,nop,wscale 7], length 0
19:21:28.744929 IP (tos 0x0, ttl 64, id 0, offset 0, flags [DF], proto TCP (6), length 60)
    10.10.1.124.2049 > 10.10.1.169.715: Flags [S.], cksum 0xcede (correct), seq 3513680991, ack 3779234243, win 26244, options [mss 8760,sackOK,TS val 3408849129 ecr 1662723,nop,wscale 2], length 0
19:21:28.744955 IP (tos 0x0, ttl 64, id 54978, offset 0, flags [DF], proto TCP (6), length 52)
    10.10.1.169.715 > 10.10.1.124.2049: Flags [.], cksum 0x175f (incorrect -> 0x7fda), ack 1, win 211, options [nop,nop,TS val 1662724 ecr 3408849129], length 0
19:21:28.745072 IP (tos 0x0, ttl 64, id 54979, offset 0, flags [DF], proto TCP (6), length 96)
    10.10.1.169.715 > 10.10.1.124.2049: Flags [P.], cksum 0x178b (incorrect -> 0x631f), seq 1:45, ack 1, win 211, options [nop,nop,TS val 1662724 ecr 3408849129], length 44: NFS request xid 1453637391 40 null
...
```

## Steps To Reproduce
Please list the steps to reproduce the issue in this section.

1. Install Docker in AWS with a CentOS AMI

2. Run `sudo docker plugin install --grant-all-permissions rexray/efs EFS_ACCESSKEY=${var.aws_access_key} EFS_SECRETKEY=${var.aws_secret_key} EFS_SECURITYGROUPS=${aws_security_group.nfs.id} EFS_TAG=rexray` (replacing the keys and security groups with your own settings)

3. Run a container with the volume driver: `docker run -it --rm --volume-driver rexray/efs -v swarm-efs-test:/data busybox ls /data`

## Configuration Files
No changes made. This is running as a docker plugin.

### Service Log
I didn't see anything in the rexray log under /var/lib/docker/plugins/.../rootfs/var/log/rexray/rexray.log other than the version output.

### Client Log
Not available.

**Comment by mbrewster** [comment]
Any update on this? I see similar behavior, and believe it may be related to API rate limit issues as well.

**Comment by bmitch3020** [comment]
I haven't seen any response from the developers. It should be an easy fix to default to nfs4. We opted to abandon RexRay in favor of mounting the EFS drives on each node in our swarm and doing host volume mounts into our containers from there. It's not pretty, but it's fast and easy for us to maintain.

**Comment by cnjr2** [comment]
I am experiencing exactly the same behabiour as **sudo-bmitch**. 

```
# time docker run -ti -v efs-test-volume:/data alpine ls /data
real	1m0.797s
user	0m0.064s
sys	0m0.004s
```

Below is some info on my setup.
```
# docker plugin inspect rexray/efs
[
    {
        "Config": {
            "Args": {
                "Description": "",
                "Name": "",
                "Settable": null,
                "Value": null
            },
            "Description": "REX-Ray for Amazon EFS",
            "DockerVersion": "18.02.0-ce",
            "Documentation": "https://github.com/thecodeteam/rexray/.docker/plugins/efs",
            "Entrypoint": [
                "/rexray.sh",
                "rexray",
                "start",
                "-f",
                "--nopid"
            ],
...
```

```
# rexray version
REX-Ray
-------
Binary: /usr/bin/rexray
Flavor: client+agent+controller
SemVer: 0.11.2
OsArch: Linux-x86_64
Commit: fc8bfbd2d02c2690fc3a755a9560dd12c88e0852
Formed: Sat, 24 Feb 2018 23:51:22 UTC
```

**Comment by cnjr2** [comment]
not sure how this is immediately related, but I now get immediate mounts after I set `LINUX_VOLUME_FILEMODE=0777` (to write as non-root user) during EFS plugin installation.

**Comment by cnjr2** [comment]
any ideas how to fix this other than @sudo-bmitch 's workaround?

**Comment by PoweredByPeople** [comment]
Any update on this? I have the same issue impacting the performance of my system and ability to failover my services quickly.
